{
  "schemaVersion": 1,
  "contentVersion": 4,
  "id": "L06",
  "title": "At the control-room door",
  "level": "capstone",
  "estimatedMinutes": 50,
  "prerequisites": [
    "L05"
  ],
  "objectives": [
    "Build a five-minute tumbling summary with an outcome threshold.",
    "Recognize bucket-boundary effects and threshold limitations.",
    "Follow up with a focused success-action search and check chronology manually.",
    "Distinguish Search output from detection rules and verified incident conclusions."
  ],
  "story": "MIDNIGHT AT MERIDIAN / CHAPTER 6 — The sponsor finally admits the VIP slide came in a demonstration package. A backstage checklist also exposes a shared publishing password. That explains a risky path, but who used it and when are still open questions. Check short failure bursts and prepare a focused successful-login follow-up. Finish with a defensible handoff, not a convenient culprit.",
  "teaching": [
    {
      "heading": "Check capability before using windows",
      "text": "Google documents these tumbling windows as preview/pre-GA, with availability depending on customer and region. Do not enable a preview for this course. Missing capability leaves workplace practice pending."
    },
    {
      "heading": "A bucket has an edge",
      "text": "by 5m makes fixed five-minute groups, not every possible rolling five-minute period. Activity across a boundary can split into separate groups."
    },
    {
      "heading": "A threshold is a filter, not a verdict",
      "text": "condition: $failures > 3 keeps summary groups above three. Four records can meet that teaching threshold; they do not prove four attacks or authorize an operational detection."
    },
    {
      "heading": "Follow up and keep chronology private",
      "text": "A second ALLOW search for an account can support a follow-up. Compare times and identity context inside SecOps. Two independent queries alone do not prove that success followed failure or shared a session."
    },
    {
      "heading": "A useful handoff separates facts from hypotheses",
      "text": "State the observed change, relevant account/host/time scope, competing explanations and next evidence needed. Failure bursts followed by success can matter, but these separate queries do not establish a sequence or who was behind an account. Do not turn a teaching threshold into a detection standard."
    }
  ],
  "challenges": [
    {
      "id": "L06-C01",
      "title": "Put failures into five-minute buckets",
      "prompt": "Select USER_LOGIN, FAIL action, and nonempty principal.user.userid. Group by that user in fixed five-minute buckets. Output distinct metadata.id count, retain count > 3, order descending by that count, and limit to 20 rows.",
      "symbolIds": [],
      "referenceQuery": "metadata.event_type = \"USER_LOGIN\"\nsecurity_result.action = \"FAIL\"\nprincipal.user.userid != \"\"\n$user = principal.user.userid\nmatch:\n  $user by 5m\noutcome:\n  $failures = count_distinct(metadata.id)\ncondition:\n  $failures > 3\norder:\n  $failures desc\nlimit:\n  20",
      "acceptedVariants": [
        "events:\n  principal.user.userid != \"\"\n  security_result.action = \"FAIL\"\n  metadata.event_type = \"USER_LOGIN\"\nmatch:\n  principal.user.userid by 5m\noutcome:\n  $n = count_distinct(metadata.id)\ncondition:\n  $n >= 4\norder:\n  $n desc\nlimit:\n  20"
      ],
      "hints": [
        "Extend the earlier grouped distinct-record summary with a five-minute tumbling bucket.",
        "Use by 5m in match and compare the outcome count in condition; keep order and limit.",
        "metadata.event_type = \"USER_LOGIN\"\nsecurity_result.action = \"FAIL\"\nprincipal.user.userid != \"\"\nmatch:\n  principal.user.userid by 5m\noutcome:\n  $failures = count_distinct(metadata.id)\ncondition:\n  $failures > 3\norder:\n  $failures desc\nlimit:\n  20"
      ],
      "methodQuestions": [
        {
          "id": "M1",
          "prompt": "Why can a short burst be split into two lower counts?",
          "options": [
            {
              "id": "A",
              "label": "order desc divides large groups into equal halves."
            },
            {
              "id": "B",
              "label": "Its events can fall on opposite sides of a fixed bucket boundary."
            },
            {
              "id": "C",
              "label": "limit 20 divides the input time range into twenty buckets."
            }
          ],
          "correctOption": "B",
          "rationale": "Fixed five-minute buckets have boundaries; one short sequence can span two of them."
        },
        {
          "id": "M2",
          "prompt": "Which integer-count condition is equivalent to $failures > 3?",
          "options": [
            {
              "id": "A",
              "label": "$failures >= 4"
            },
            {
              "id": "B",
              "label": "$failures >= 3"
            },
            {
              "id": "C",
              "label": "$failures = 4"
            }
          ],
          "correctOption": "A",
          "rationale": "> 3 retains counts 4, 5, 6 and higher. >= 4 does the same; = 4 would exclude higher counts."
        }
      ],
      "mission": {
        "support": "shown",
        "beat": "Could failures be clustered into a short burst rather than spread across rehearsal? Build five-minute buckets and use the supplied teaching threshold. This is a Search summary, not a deployed detection rule.",
        "example": "metadata.event_type = \"USER_LOGIN\"\nsecurity_result.action = \"FAIL\"\nprincipal.user.userid != \"\"\n$user = principal.user.userid\nmatch:\n  $user by 5m\noutcome:\n  $failures = count_distinct(metadata.id)\ncondition:\n  $failures > 3\norder:\n  $failures desc\nlimit:\n  20",
        "starter": "metadata.event_type = \"USER_LOGIN\"\nsecurity_result.action = \"FAIL\"\nprincipal.user.userid != \"\"\n$user = principal.user.userid\nmatch:\n  $user by 5m\noutcome:\n  $failures = count_distinct(metadata.id)\ncondition:\n  $failures > 3\norder:\n  $failures desc\nlimit:\n  20",
        "explanation": [
          {
            "part": "match: $user by 5m",
            "meaning": "A group for each account in fixed five-minute buckets."
          },
          {
            "part": "$failures",
            "meaning": "A name for the distinct-record count in each group."
          },
          {
            "part": "condition: $failures > 3",
            "meaning": "Keep groups with at least four counted records."
          },
          {
            "part": "order and limit",
            "meaning": "Rank those summaries, then show up to twenty."
          }
        ],
        "remember": "A bucket has edges. A threshold is not a verdict.",
        "caseUpdate": "Case clue: a failure burst would justify a timing follow-up. It would not, by itself, prove password spraying, a successful compromise or which person used the account.",
        "caveat": "Google documents tumbling windows as preview/pre-GA and customer/region dependent. Do not enable a preview for this course. If unavailable, continue with the course example.",
        "gaps": [],
        "analystNote": {
          "concept": "Pattern needs corroboration",
          "text": "A burst can come from retries or automation. Password spraying usually concerns attempts across accounts; this account-grouped query alone cannot establish it. Bucket boundaries can split a burst."
        }
      }
    },
    {
      "id": "L06-C02",
      "title": "Build the final follow-up yourself",
      "prompt": "Select USER_LOGIN events with ALLOW action and principal.user.userid exactly [USER]. Return event rows. This query alone does not establish success-after-failure chronology.",
      "symbolIds": [
        "USER"
      ],
      "referenceQuery": "metadata.event_type = \"USER_LOGIN\"\nsecurity_result.action = \"ALLOW\"\nprincipal.user.userid = \"__USER__\"",
      "acceptedVariants": [
        "principal.user.userid = \"__USER__\" AND metadata.event_type = \"USER_LOGIN\" AND security_result.action = \"ALLOW\""
      ],
      "hints": [
        "Choose the candidate user inside SecOps; keep only [USER] on the site.",
        "Use USER_LOGIN, ALLOW action, and the exact actor userid as required filters.",
        "metadata.event_type = \"USER_LOGIN\"\nsecurity_result.action = \"ALLOW\"\nprincipal.user.userid = \"__USER__\""
      ],
      "methodQuestions": [
        {
          "id": "M1",
          "prompt": "Does this separate ALLOW search prove those events occurred after the earlier failures?",
          "options": [
            {
              "id": "A",
              "label": "Yes; running the ALLOW query second establishes event order."
            },
            {
              "id": "B",
              "label": "Yes; the USER_LOGIN type links each success to its previous failure."
            },
            {
              "id": "C",
              "label": "No; the filters do not join the searches or enforce their time order."
            }
          ],
          "correctOption": "C",
          "rationale": "Query execution order is not event chronology. A separate filter does not express a cross-event time relationship."
        },
        {
          "id": "M2",
          "prompt": "Which version preserves the requested successful-login account scope?",
          "options": [
            {
              "id": "A",
              "label": "USER_LOGIN OR ALLOW OR the exact principal account."
            },
            {
              "id": "B",
              "label": "USER_LOGIN AND ALLOW AND the exact principal account."
            },
            {
              "id": "C",
              "label": "USER_LOGIN AND (ALLOW OR the exact principal account)."
            }
          ],
          "correctOption": "B",
          "rationale": "All three requirements must hold together. The alternatives admit records that fail at least one required condition."